{
  "benchmark_host": "nextstat-bench",
  "freshness_observation": {
    "cases_outside_promoted_stable_runtime_boundary": 0,
    "export_matrix_case_count": 7,
    "policy_status": "accepted",
    "public_case_count": 5,
    "public_min_net_end_to_end_upper_limit_speedup": 0.9648766256597925,
    "public_validation_status": "ok",
    "reference_date": "2026-03-10",
    "snapshot_age_days": 0,
    "snapshot_date": "2026-03-10",
    "snapshot_id": "export-20260310T001421Z-public-floor-five",
    "snapshot_status": "persisted",
    "stable_promotion_status": "accepted",
    "stable_promotion_support_class": "stable",
    "synthetic_min_net_end_to_end_upper_limit_speedup": 2.0821942313909845
  },
  "freshness_policy": {
    "max_snapshot_age_days": 45,
    "require_cases_inside_promoted_stable_runtime_boundary": true,
    "require_policy_case_floors": true,
    "require_policy_status": "accepted",
    "require_public_validation_status": "ok",
    "require_snapshot_status": "persisted",
    "require_stable_promotion_status": "accepted",
    "require_stable_promotion_support_class": "stable"
  },
  "generated_at_utc": "1970-01-01T00:00:00Z",
  "reference_date": "2026-03-10",
  "report_kind": "stable_evidence_freshness",
  "schema_version": "nextstat_simplified_likelihood_exporter_stable_evidence_freshness_report_v0",
  "source_artifacts": {
    "policy_doc_path": "docs/benchmarks/simplified-likelihood-exporter-stable-evidence-policy-2026-03-09.md",
    "policy_example_path": "docs/specs/benchmarks/simplified_likelihood_exporter_stable_evidence_policy_v0.example.json",
    "policy_schema_path": "docs/schemas/benchmarks/simplified_likelihood_exporter_stable_evidence_policy_v0.schema.json",
    "public_validation_report_path": "benchmarks/artifacts/simplified_likelihood_export_benchmarks/nextstat-bench/current/export_public_validation_report.json",
    "snapshot_report_path": "benchmarks/artifacts/simplified_likelihood_export_benchmarks/nextstat-bench/current/export_benchmark_snapshot_report.json",
    "stable_evidence_policy_path": "benchmarks/artifacts/simplified_likelihood_exporter_promotion_bundles/nextstat-bench/accepted/stable_evidence_policy.json",
    "stable_promotion_decision_path": "benchmarks/artifacts/simplified_likelihood_exporter_promotion_bundles/nextstat-bench/accepted/stable_promotion_decision.json"
  },
  "status": "fresh",
  "summary": {
    "benchmark_host": "nextstat-bench",
    "export_matrix_case_count": 7,
    "max_snapshot_age_days": 45,
    "public_case_count": 5,
    "snapshot_age_days": 0,
    "snapshot_id": "export-20260310T001421Z-public-floor-five",
    "status": "fresh",
    "top_level_failures": []
  },
  "support_class": "stable",
  "surface": "simplified_likelihood_exporter",
  "validity": {
    "failures": [],
    "passed": true,
    "status": "passed",
    "warnings": []
  }
}
